{
  "meta": {
    "title": "DeepIQ",
    "description": "DeepIQ turns complex data into clear, intelligent business outcomes."
  },
  "text": {
    ".brand span": "DEEP",
    ".brand b": "IQ",
    ".mobile-nav > p": "Think deeper. Move smarter.",
    ".hero-copy": "We transform complex data into decisive systems that help ambitious businesses see further and move faster.",
    ".statement-copy .lead": "DeepIQ is a technology partner for organizations ready to turn information into action.",
    ".statement-copy > p:nth-child(2)": "We connect strategy, data, engineering and experience design to create intelligent platforms that work in the real world—not just on presentation slides.",
    ".solutions-head > p": "A connected portfolio of intelligence, automation and infrastructure solutions—designed around your business, your data and your next move.",
    ".services-sticky > p": "Deep expertise across the full transformation lifecycle.",
    ".signal-content > p:last-child": "We bring business clarity and engineering depth into one room—so every solution has a reason, a result and a path forward.",
    ".contact-intro": "Have a complex problem, a bold opportunity, or just a question? Tell us where you want to go.",
    ".footer-message p": "Intelligence in motion.",
    ".footer-message span": "Colombo · Sri Lanka",
    "#contact-form label:nth-child(1) > span": "First Name *",
    "#contact-form label:nth-child(2) > span": "Last Name *",
    "#contact-form label:nth-child(3) > span": "Email *"
  },
  "html": {
    ".desktop-nav": "<a href='#story'>Our Story</a><a href='#solutions'>Solutions</a><a href='#services'>Services</a><a href='#contact'>Contact</a><button class='partner-button' type='button'>Become a Partner</button>",
    ".mobile-nav nav": "<a href='#top'><span>01</span>Home</a><a href='#story'><span>02</span>Our Story</a><a href='#solutions'><span>03</span>Solutions</a><a href='#services'><span>04</span>Services</a><a href='#contact'><span>05</span>Contact</a><button class='partner-button mobile-partner-button' type='button'>Become a Partner</button>",
    ".hero-kicker": "<span></span>AI · DATA · DIGITAL SYSTEMS",
    "#hero-title": "<span class='line'><span>Intelligence</span></span><span class='line outline'><span>in motion.</span></span>",
    ".hero-content .text-link": "Discover DeepIQ <i aria-hidden='true'>↘</i>",
    ".hero-index": "<span>01</span><i></i><span>05</span>",
    ".scroll-cue": "<span>SCROLL TO EXPLORE</span><i>↓</i>",
    "#story .section-label": "<span>01</span><i></i><p>OUR STORY</p>",
    "#story .display-title": "We make<br><em>complexity</em><br>useful.",
    ".statement-copy .text-link": "See what we build <i aria-hidden='true'>↘</i>",
    ".metrics": "<article class='metric reveal'><strong><span data-count='100' data-suffix='%'>0</span></strong><p>TAILORED SOLUTIONS</p></article><article class='metric reveal'><strong><span data-count='24' data-suffix='/7'>0</span></strong><p>SYSTEM OBSERVABILITY</p></article><article class='metric reveal'><strong><span data-count='4' data-prefix='0'>0</span></strong><p>CORE PRACTICES</p></article><article class='metric reveal'><strong><span data-count='1' data-prefix='0'>0</span></strong><p>CONNECTED TEAM</p></article>",
    "#solutions .section-label": "<span>02</span><i></i><p>OUR SOLUTIONS</p>",
    ".solutions-head .display-title": "Ideas engineered<br>for <em>impact.</em>",
    ".solution-list": "<a class='solution-row reveal' href='/cloudmon' aria-label='Explore Cloudmon unified observability'><span class='solution-no'>01</span><div><h3>Cloudmon</h3><p></p></div><span class='solution-icon' aria-hidden='true'>↗</span></a><a class='solution-row reveal' href='#contact'><span class='solution-no'>02</span><div><h3>Rayan</h3><p></p></div><span class='solution-icon' aria-hidden='true'>↗</span></a><a class='solution-row reveal' href='/miphi' aria-label='Explore MiPhi enterprise storage'><span class='solution-no'>03</span><div><h3>MiPhi</h3><p></p></div><span class='solution-icon' aria-hidden='true'>↗</span></a><a class='solution-row reveal' href='#contact'><span class='solution-no'>04</span><div><h3>Cyber Resilience</h3><p></p></div><span class='solution-icon' aria-hidden='true'>↗</span></a>",
    ".marquee-track": "<span>DATA <i>✦</i> AI <i>✦</i> CLOUD <i>✦</i> SECURITY <i>✦</i> AUTOMATION <i>✦</i> EXPERIENCE <i>✦</i></span><span aria-hidden='true'>DATA <i>✦</i> AI <i>✦</i> CLOUD <i>✦</i> SECURITY <i>✦</i> AUTOMATION <i>✦</i> EXPERIENCE <i>✦</i></span>",
    "#services .section-label": "<span>03</span><i></i><p>HOW WE HELP</p>",
    ".services-sticky .display-title": "From first signal<br>to <em>scale.</em>",
    ".service-cards": "<article class='service-card reveal'><span>01</span><div class='service-symbol'>⌁</div><h3>Discover</h3><p>Opportunity mapping, data audits and a practical roadmap for measurable progress.</p></article><article class='service-card reveal'><span>02</span><div class='service-symbol'>◇</div><h3>Design</h3><p>Human-centered experiences and technical architecture built around real needs.</p></article><article class='service-card reveal'><span>03</span><div class='service-symbol'>⌬</div><h3>Build</h3><p>Production-grade platforms, AI systems, automations and integrations.</p></article><article class='service-card reveal'><span>04</span><div class='service-symbol'>↗</div><h3>Evolve</h3><p>Continuous optimization, observability and support as your ambitions grow.</p></article>",
    ".signal-content .eyebrow": "<span></span>THE DEEPIQ DIFFERENCE",
    ".signal-content h2": "See the signal.<br><em>Shape what’s next.</em>",
    "#contact .section-label": "<span>04</span><i></i><p>START A CONVERSATION</p>",
    ".contact-layout .display-title": "Let’s build<br>what’s <em>next.</em>",
    "#contact-form": "<label><span>First Name *</span><input name='First Name' type='text' autocomplete='given-name' required placeholder='Jane'></label><label><span>Last Name *</span><input name='Last Name' type='text' autocomplete='family-name' required placeholder='Doe'></label><label><span>Email *</span><input name='Email' type='email' autocomplete='email' required placeholder='jane@company.com'></label><label><span>Phone Number</span><input name='Phone Number' type='tel' autocomplete='tel' placeholder='+94 74 123 4567'></label><label><span>Company Name</span><input name='Company Name' type='text' autocomplete='organization' placeholder='Company name'></label><div class='product-field'><span>Preferred Product</span><div class='product-select' data-product-select><input class='product-select-input' name='Preferred Product' type='hidden'><button class='product-select-trigger' type='button' aria-haspopup='listbox' aria-expanded='false'><span class='product-select-value'>Select a product</span><i aria-hidden='true'></i></button><div class='product-select-menu' role='listbox' aria-label='Preferred Product'><button class='product-option' type='button' role='option' data-value='Cloudmon' aria-selected='false'>Cloudmon</button><button class='product-option' type='button' role='option' data-value='Rayan' aria-selected='false'>Rayan</button><button class='product-option' type='button' role='option' data-value='MiPhi' aria-selected='false'>MiPhi</button><button class='product-option' type='button' role='option' data-value='Cyber Resilience' aria-selected='false'>Cyber Resilience</button></div></div></div><label><span>Message *</span><textarea name='Message' rows='3' required placeholder='How can we help you?'></textarea></label><label class='robot-check'><input name='Verification' type='checkbox' value='Confirmed' required><span>I'm not a robot</span></label><button type='submit'>SEND ENQUIRY <i aria-hidden='true'>↗</i></button><p class='form-status' role='status' aria-live='polite'></p>",
    ".whatsapp-button": "<svg viewBox='0 0 24 24' aria-hidden='true'><path d='M20.6 11.7a8.6 8.6 0 0 1-12.7 7.6l-4.4 1.2 1.2-4.2a8.6 8.6 0 1 1 15.9-4.6Z'></path><path d='M8.2 7.7c.3-.5.6-.5.9-.1l1.1 1.5c.2.3.2.6 0 .9l-.7.8c.7 1.4 1.8 2.5 3.2 3.2l.8-.7c.3-.2.6-.2.9 0l1.5 1.1c.4.3.4.6-.1.9-.7.5-1.5.8-2.3.6-3.2-.7-5.8-3.3-6.5-6.5-.2-.8.1-1.6.6-2.3Z'></path></svg>",
    ".footer-details": "<p><span class='footer-detail-icon' aria-hidden='true'>⌖</span><span>No. 45, Galle Road, Colombo 03, Sri Lanka.</span></p><p><span class='footer-detail-icon' aria-hidden='true'>☎</span><span><a href='tel:+94742682674'>+94 74 268 2674</a></span></p><p><span class='footer-detail-icon' aria-hidden='true'>✉</span><span><a href='mailto:sales@deepiq.lk'>sales@deepiq.lk</a></span></p>",
    ".footer-links": "<h3>Useful Links</h3><a href='#top'>Home</a><a href='#story'>Our Story</a><a href='#solutions'>Solutions</a><a href='#services'>Services</a><a href='#contact'>Contact</a>",
    ".footer-actions": "<div class='footer-newsletter'><h3>Subscribe to Our Newsletters</h3><form class='newsletter-field' action='mailto:sales@deepiq.lk?subject=Newsletter%20Subscription' method='post' enctype='text/plain'><input name='Subscriber email' type='email' aria-label='Email address' placeholder='Your email address' required><button type='submit'>Submit</button></form></div><div class='footer-socials'><h3>Follow Us On</h3><div class='social-buttons'><button class='facebook-social' type='button' aria-label='Facebook'><span aria-hidden='true'>f</span></button><a class='linkedin-social' href='https://www.linkedin.com/company/deepiq-lk?trk=public_profile_topcard-current-company' target='_blank' rel='noopener noreferrer' aria-label='DeepIQ on LinkedIn'><span aria-hidden='true'>in</span></a><button class='instagram-social' type='button' aria-label='Instagram'><svg viewBox='0 0 24 24' aria-hidden='true'><rect x='3.5' y='3.5' width='17' height='17' rx='5'></rect><circle cx='12' cy='12' r='4'></circle><circle class='instagram-dot' cx='17.4' cy='6.7' r='1.2'></circle></svg></button></div></div>",
    ".copyright": "© <span id='year'></span> DEEPIQ. ALL RIGHTS RESERVED.",